"","Use of image analysis to quantitate changes in form of mitochondrial DNA after x-irradiation."," ","","","","1989-11-07T00:00:00Z","","2488599"
"","A set of Macintosh computer programs for the design and analysis of synthetic genes."," ","","","","1989-07-28T00:00:00Z","","2569922"
"","[Changes in 5-methylcytosine content of plant DNA in proportion to the amount of flowering]."," ","","","","","","667216"
"","Genetic transformation of the plant pathogens Phytophthora capsici and Phytophthora parasitica."," ","","","","1991-08-11T00:00:00Z","","1651483"
"","Microcomputer programs for prediction and comparative evaluation of protein secondary structure from"," ","","","","1985-08-30T00:00:00Z","","2412771"
"","Identification of a plant-derived mollicute as a strain of an avian pathogen, Mycoplasma iowae, and "," ","","","","1991-10-20T00:00:00Z","","1720652"
"","Molecular cloning of an 1-aminocyclopropane-1-carboxylate synthase from senescing carnation flower p"," ","","","","1992-01-13T00:00:00Z","","1731995"
"","Diverse groups of plant RNA and DNA viruses share related movement proteins that may possess chapero"," ","","","","1991-12-30T00:00:00Z","","1684985"
"","Effects of ethanol and various alcoholic beverages on the formation of O6-methyldeoxyguanosine from "," ","","","","1992-07-24T00:00:00Z","","1638683"
